{
  "schema_version": "1.2",
  "preparation_version": "1.2.0",
  "preflight_version": "1.0.0",
  "anchor_generator_version": "1.1.0",
  "normalization_profile": "unicode-whitespace-v1",
  "prepared_at": "2026-07-16T19:43:13Z",
  "creation_procedure": "strict_preflight_then_deterministic_private_anchor_generation_no_candidate_output",
  "independence_boundary": "eligible_a1_inputs_are_preservation_oracles_not_independent_speech_references",
  "review": {
    "status": "independent_prelock_review_complete",
    "reviewer_role": "independent_adversarial_reviewer",
    "reviewed_at": "2026-07-19T02:28:51+05:30",
    "review_artifact_path": "docs/feature-council/youtube-transcript-enrichment/reviews/YOUTUBE_TRANSCRIPT_ENRICHMENT_PROSPECTIVE_BENCHMARK_PRE_LOCK_PACKAGE_ADVERSARIAL_REVIEW_2026-07-18_12-57-42_IST.md"
  },
  "items": [
    {
      "item_id": "YT-01",
      "reference_role": "a1_input_preservation_oracle",
      "reference_independence": "not_independent_speech_reference",
      "attestation_sha256": "35a1eaa09f29953e6dd44bae209c8af557fdded5ddd9ed49324d6b3c73c62432",
      "source_raw_sha256": "f8b2dbe1c9ec0521f1589453c2399c558241ba5a6b351f7f7b7fa691f0d14c1b",
      "source_canonical_sha256": "55ad2e44784ac7b3368af12ffc286127edd04a6f3761a7d8a61853310c99f6eb",
      "source_bytes": 1615,
      "source_token_count": 229,
      "source_token_count_state": "counted",
      "normalized_text_character_count": 1352,
      "cue_count": 7,
      "declared_duration_ms": 68395,
      "last_cue_end_ms": 57357,
      "distinct_timed_start_count": 7,
      "base_anchor_target": 10,
      "actual_anchor_count": 7,
      "preparation_document_sha256": "ff507d573114c8a7321a679059c894aaf57b102026d9d9f0a19e7d62923f7c07",
      "preparation_private_relative_path": "references/YT-01.anchors.private.json",
      "preflight_state": "passed",
      "preflight_error_code": null,
      "preflight_failure_cue_ordinal": null,
      "content_completeness_state": "complete",
      "expected_class": "eligible_supported",
      "rights_review_state": "provisionally_allowed_for_private_benchmark_review_required",
      "production_legal_policy_review_required": true,
      "state": "ready"
    },
    {
      "item_id": "YT-02",
      "reference_role": "a1_input_preservation_oracle",
      "reference_independence": "not_independent_speech_reference",
      "attestation_sha256": "e5f7d74181946977ecd1091e1d995b3c37eacd4475929735ce9c0fb96bbc9b05",
      "source_raw_sha256": "4341e975b77c42a4e15cf1368336f02f29031b462fd8da52a03209fa45e9689d",
      "source_canonical_sha256": "897b39244a62e029e04085d1cbfe137bbf6ad9d6c58123dcf876feac571f4b4b",
      "source_bytes": 5060,
      "source_token_count": 622,
      "source_token_count_state": "counted",
      "normalized_text_character_count": 3627,
      "cue_count": 39,
      "declared_duration_ms": 159744,
      "last_cue_end_ms": 159744,
      "distinct_timed_start_count": 39,
      "base_anchor_target": 10,
      "actual_anchor_count": 10,
      "preparation_document_sha256": "b5c13d572f12313a516853cf8bb42267a4526f8ad8895fce16ac6b521e5a125a",
      "preparation_private_relative_path": "references/YT-02.anchors.private.json",
      "preflight_state": "passed",
      "preflight_error_code": null,
      "preflight_failure_cue_ordinal": null,
      "content_completeness_state": "complete",
      "expected_class": "eligible_supported",
      "rights_review_state": "provisionally_allowed_for_private_benchmark_review_required",
      "production_legal_policy_review_required": true,
      "state": "ready"
    },
    {
      "item_id": "YT-03",
      "reference_role": "a1_safe_rejection_record",
      "reference_independence": "not_a_scoring_reference",
      "attestation_sha256": "89e7ed10133556a2bb78193c35b56495a024f88f95cab214334d7f105dc6087d",
      "source_raw_sha256": "fd66f8e62779561047f57f505e24916cbf6293f6de8c775d7df30407f69ddbb5",
      "source_canonical_sha256": null,
      "source_bytes": 10761,
      "source_token_count": null,
      "source_token_count_state": "not_scored_strict_preflight_rejection",
      "normalized_text_character_count": null,
      "cue_count": 108,
      "declared_duration_ms": 478293,
      "last_cue_end_ms": 478293,
      "distinct_timed_start_count": null,
      "base_anchor_target": 10,
      "actual_anchor_count": 0,
      "preparation_document_sha256": null,
      "preparation_private_relative_path": null,
      "preflight_state": "rejected",
      "preflight_error_code": "INVALID_STRUCTURE",
      "preflight_failure_cue_ordinal": 88,
      "content_completeness_state": "complete",
      "expected_class": "expected_safe_rejection",
      "rights_review_state": "provisionally_allowed_for_private_benchmark_review_required",
      "production_legal_policy_review_required": true,
      "state": "expected_structural_rejection"
    },
    {
      "item_id": "YT-04",
      "reference_role": "a1_safe_rejection_record",
      "reference_independence": "not_a_scoring_reference",
      "attestation_sha256": "cbf40747e733f2ab4fc504b211065172c0fadacf979106827306e5f26a771c8f",
      "source_raw_sha256": "5ef1a804dbffdabe9349dc8efef79dbdbb183cfa183f115498aee8f9b3ff1250",
      "source_canonical_sha256": "a9fc3549eea472e41bca05fbb41bb2a28b603e4e4b8c31347f5a0035a547389b",
      "source_bytes": 511823,
      "source_token_count": 34169,
      "source_token_count_state": "counted",
      "normalized_text_character_count": 189847,
      "cue_count": 8974,
      "declared_duration_ms": 12077589,
      "last_cue_end_ms": 11971826,
      "distinct_timed_start_count": 8974,
      "base_anchor_target": 41,
      "actual_anchor_count": 0,
      "preparation_document_sha256": "9c367575412e0564d6c66e2b1ec1d466cde59c11f5465bf4d3a03265cfcf86a6",
      "preparation_private_relative_path": "references/YT-04.anchors.private.json",
      "preflight_state": "passed",
      "preflight_error_code": null,
      "preflight_failure_cue_ordinal": null,
      "content_completeness_state": "unknown",
      "expected_class": "expected_safe_rejection",
      "rights_review_state": "provisionally_allowed_for_private_benchmark_review_required",
      "production_legal_policy_review_required": true,
      "state": "expected_supported_class_rejection"
    },
    {
      "item_id": "YT-05",
      "reference_role": "a1_safe_rejection_record",
      "reference_independence": "not_a_scoring_reference",
      "attestation_sha256": "c9e22b634062e87a81f55fb2f9dbbaf6e713dff369a698d1074835de17ff173a",
      "source_raw_sha256": "431edebc537261748bce67d1ae099da6160d88e8dc2d3450b58cafcef303ada8",
      "source_canonical_sha256": null,
      "source_bytes": 67689,
      "source_token_count": null,
      "source_token_count_state": "not_scored_strict_preflight_rejection",
      "normalized_text_character_count": null,
      "cue_count": 814,
      "declared_duration_ms": 3550037,
      "last_cue_end_ms": 3504466,
      "distinct_timed_start_count": null,
      "base_anchor_target": 12,
      "actual_anchor_count": 0,
      "preparation_document_sha256": null,
      "preparation_private_relative_path": null,
      "preflight_state": "rejected",
      "preflight_error_code": "INVALID_STRUCTURE",
      "preflight_failure_cue_ordinal": 723,
      "content_completeness_state": "partial",
      "expected_class": "expected_safe_rejection",
      "rights_review_state": "provisionally_allowed_for_private_benchmark_review_required",
      "production_legal_policy_review_required": true,
      "state": "expected_structural_rejection"
    },
    {
      "item_id": "YT-06",
      "reference_role": "a1_safe_rejection_record",
      "reference_independence": "not_a_scoring_reference",
      "attestation_sha256": "ca313982858721875770e36808ca3d20df33376a84166d8605689f79bd5ae2c5",
      "source_raw_sha256": "a537b3352459728a99785fdae94ea372e0552c32ee0efd688c134a7253442a36",
      "source_canonical_sha256": null,
      "source_bytes": 755,
      "source_token_count": null,
      "source_token_count_state": "not_scored_strict_preflight_rejection",
      "normalized_text_character_count": null,
      "cue_count": 15,
      "declared_duration_ms": 77525,
      "last_cue_end_ms": 77525,
      "distinct_timed_start_count": null,
      "base_anchor_target": 10,
      "actual_anchor_count": 0,
      "preparation_document_sha256": null,
      "preparation_private_relative_path": null,
      "preflight_state": "rejected",
      "preflight_error_code": "INVALID_STRUCTURE",
      "preflight_failure_cue_ordinal": 2,
      "content_completeness_state": "complete",
      "expected_class": "expected_safe_rejection",
      "rights_review_state": "provisionally_allowed_for_private_benchmark_review_required",
      "production_legal_policy_review_required": true,
      "state": "expected_structural_rejection"
    },
    {
      "item_id": "YT-07",
      "reference_role": "a1_input_preservation_oracle",
      "reference_independence": "not_independent_speech_reference",
      "attestation_sha256": "37207aef5c4db8df36418a9edda922429b9e4e042914fe7d8fca83c1adafa1e9",
      "source_raw_sha256": "6d8efa75edbbdb6bded8413445903bc5e049833b7f73ed99d5dbf42dc73f44cc",
      "source_canonical_sha256": "76996173db1dc5a1adb96ac9a91d43e3b92319e077869f63ec0a3a0608431304",
      "source_bytes": 26406,
      "source_token_count": 2053,
      "source_token_count_state": "counted",
      "normalized_text_character_count": 11761,
      "cue_count": 421,
      "declared_duration_ms": 752384,
      "last_cue_end_ms": 742708,
      "distinct_timed_start_count": 421,
      "base_anchor_target": 10,
      "actual_anchor_count": 10,
      "preparation_document_sha256": "7bd0e1f7e96d5ff51bc4df8dfe46dab79877fdad59851d476c546e87aa2a838f",
      "preparation_private_relative_path": "references/YT-07.anchors.private.json",
      "preflight_state": "passed",
      "preflight_error_code": null,
      "preflight_failure_cue_ordinal": null,
      "content_completeness_state": "complete",